{
  "plan_id": "checkpoint_no_softlock_gate4_plan",
  "requirement_id": "checkpoint_no_softlock",
  "requirement": "Checkpoint respawn must not softlock progression.",
  "cases": [
    {
      "id": "checkpoint_state_persistence_unit",
      "layer": "unit",
      "title": "Checkpoint restore preserves opened-door progression state",
      "template": "checkpoint_state_persistence_unit",
      "assertions": [
        "door_open remains true after checkpoint restore"
      ]
    },
    {
      "id": "checkpoint_respawn_extraction_playmode",
      "layer": "playmode",
      "title": "Checkpoint respawn allows extraction without softlock",
      "template": "checkpoint_respawn_extraction_playmode",
      "assertions": [
        "debug_state records progression_softlock false"
      ]
    }
  ]
}
